{"checksum":"sha256:bfa226f2d41614349565926767ac3f13a78a83e04ee0e2086239a5634ba410fe","format":"handoffkit.security.replay","format_version":1,"generation":7,"records":[{"credential_fingerprint":"sha256:aaaaaaaaaaaaaaaaaaaaaaaaaaaaaaaaaaaaaaaaaaaaaaaaaaaaaaaaaaaaaaaa","expires_at":4102444800,"last_sequence":42,"nonces":[{"seen_at":2000000000,"value":"nonce-001"},{"seen_at":2000000001,"value":"nonce-002"}],"peer_id":"peer-a","scope":"sha256:aaaaaaaaaaaaaaaaaaaaaaaaaaaaaaaaaaaaaaaaaaaaaaaaaaaaaaaaaaaaaaaa|session-a","security_profile":"standard","session_id":"session-a","updated_at":2000000001}]}
